{
  "schema_version": "candidate-preparation-recipe.v1",
  "producer": "pipeline/prepare_candidate.py",
  "dataset_identity": {
    "name": "data/raw/telco-customer-churn.csv",
    "row_count_before": 7043,
    "column_count_before": 21
  },
  "discovery_evidence_ref": {
    "path": "pipeline/evidence/telco-customer-churn/discovery-evidence.json",
    "schema_version": "dataset-discovery-evidence.v1"
  },
  "transformations": [
    {
      "transformation_type": "missing_value_handling",
      "description": "Explicit approved TotalCharges preparation policy (Project Spec S0028): treat null, empty-string, or whitespace-only 'TotalCharges' values as missing; before filling, verify that every row with a blank 'TotalCharges' value has 'tenure' == 0; if and only if that verification succeeds for all blank rows, convert 'TotalCharges' to numeric and fill the verified blanks with 0.0; row dropping is not allowed by this policy; broad mean/median/mode imputation is not allowed by this policy; creating a missing-value indicator column is not allowed by this policy; if any blank 'TotalCharges' row fails verification (tenure != 0, non-numeric tenure, or otherwise), preparation is blocked and no prepared candidate is produced.",
      "source_columns": [
        "TotalCharges"
      ],
      "target_columns": [
        "TotalCharges"
      ],
      "reason": "Approved by Project Spec S0028 (Telco TotalCharges Preparation Policy Resolution), superseding the prior inferred_pending_review status. Verified against the real raw dataset (data/raw/telco-customer-churn.csv): all 11 observed blank 'TotalCharges' rows have 'tenure' == 0, confirming the fill is safe under this policy's verification predicate.",
      "review_status": "inferred_approved"
    }
  ],
  "candidate_output": {
    "produced": true,
    "reason_not_produced": null,
    "row_count_after": 7043,
    "column_count_after": 21
  },
  "candidate_status": {
    "is_final_training_input": false,
    "requires_m23_validation": true,
    "authorized_for": "candidate_only"
  },
  "generation_settings": {
    "generator_version": "prepare-candidate.v1",
    "preparation_rules_source": "pipeline.prepare_candidate:verified_conditional_fill_policy(TotalCharges)"
  },
  "generated_at": "2026-07-10T10:14:34+00:00",
  "preparation_boundary_confirmations": {
    "complex_feature_engineering_performed": false,
    "model_training_performed": false,
    "release_publication_performed": false,
    "hidden_notebook_transformations": false,
    "inferred_rules_applied_without_approval": false
  },
  "evidence_policy": {
    "raw_logs_prohibited": true,
    "raw_runtime_prohibited": true,
    "raw_api_payloads_prohibited": true,
    "secrets_prohibited": true,
    "private_source_paths_prohibited": true,
    "reduced_and_sanitized": true
  }
}